{
  "generated_at": "2026-09-04T19:52:34+00:00",
  "promotion_status": "complete",
  "schema_version": 1,
  "vendors": {
    "bullpen": {
      "built_at": "2026-08-15T10:45:03+00:00",
      "contract_version": "1.0.0",
      "digest": "sha256:dfcbf4e06309b50e784d85f1a48bf0b15eecf79a0b08cc9e31810a06b8c7958c",
      "docs_hash": "sha256:f50905f70b7d1d3bea3ce81e65fdfa75d9a66cda78af8608c9a8d87401d7dab0",
      "local_tag": "bullpen:local",
      "platform": "linux/amd64",
      "registry_ref": "us-central1-docker.pkg.dev/llmobserver-0/integration-bench-public/ib-vendor-bullpen",
      "sbom": null,
      "signature": null,
      "source_hash": "sha256:f5d295386b314408eb6f5b9179a267dae252d957632b9a24026c41e6f6d53852",
      "source_revision": "ab7432d77e320104166ba1f757dd349f6f5552c9"
    },
    "crewcall": {
      "built_at": "2026-08-15T10:45:36+00:00",
      "contract_version": "1.0.0",
      "digest": "sha256:52298e73382a26cf5f4836ad1a51d198d0ed580dad36b6b557d2442a44ae6968",
      "docs_hash": "sha256:a8145edfce70a1bdfea5fc0c373e5d2aedf340cf2b4202399f9104d1a5c331c0",
      "local_tag": "crewcall:local",
      "platform": "linux/amd64",
      "registry_ref": "us-central1-docker.pkg.dev/llmobserver-0/integration-bench-public/ib-vendor-crewcall",
      "sbom": null,
      "signature": null,
      "source_hash": "sha256:90fc9cf7dfe7ed87ff9e2b04687d36bc1d45cb24ae6d51823d0511e385717873",
      "source_revision": "ab7432d77e320104166ba1f757dd349f6f5552c9"
    },
    "globalhire": {
      "built_at": "2026-08-15T10:45:41+00:00",
      "contract_version": "1.0.0",
      "digest": "sha256:0d868a12bd9b05e146b09ae78d99177d3baf1a43e87209156820bef3adc38a83",
      "docs_hash": "sha256:c8d7fa1691e701cd2939ab7f4d6e3d206b5b2b63b49bfce7a1c00c2eec10cddf",
      "local_tag": "globalhire:local",
      "platform": "linux/amd64",
      "registry_ref": "us-central1-docker.pkg.dev/llmobserver-0/integration-bench-public/ib-vendor-globalhire",
      "sbom": null,
      "signature": null,
      "source_hash": "sha256:104d194bef1819d789711959a089e4c25641e2a8ab3e186a82f87a7b16e8e75c",
      "source_revision": "ab7432d77e320104166ba1f757dd349f6f5552c9"
    },
    "hirewire": {
      "built_at": "2026-08-15T10:45:41+00:00",
      "contract_version": "1.0.0",
      "digest": "sha256:070f818d7113e22fc272b5b25715cb8e1404c6d4291a751ae2bda2cd78d50c73",
      "docs_hash": "sha256:0362dde36cbf51d5df6e01b528d5e5de2ab9ba7d7c5b809048f2a0b2177ccf57",
      "local_tag": "hirewire:local",
      "platform": "linux/amd64",
      "registry_ref": "us-central1-docker.pkg.dev/llmobserver-0/integration-bench-public/ib-vendor-hirewire",
      "sbom": null,
      "signature": null,
      "source_hash": "sha256:39cec2fc1793723cdeb20685b74266dae10e371a85d3f2ebd34ffd9a5b694de6",
      "source_revision": "ab7432d77e320104166ba1f757dd349f6f5552c9"
    },
    "interviewly": {
      "built_at": "2026-08-15T10:46:14+00:00",
      "contract_version": "1.0.0",
      "digest": "sha256:ce528d23508cf2dcf6a270bd18e951ff2cecee065d39f87beb1f37fba6952702",
      "docs_hash": "sha256:72ec141fb079e09297b040fac29c57364e9b7fe88859f6f311718d872a71b4cf",
      "local_tag": "interviewly:local",
      "platform": "linux/amd64",
      "registry_ref": "us-central1-docker.pkg.dev/llmobserver-0/integration-bench-public/ib-vendor-interviewly",
      "sbom": null,
      "signature": null,
      "source_hash": "sha256:2349e956b76b324b5f90602ed3b6e4c8d4cb2a670c0ada76dc63f2b7c1e8cd60",
      "source_revision": "ab7432d77e320104166ba1f757dd349f6f5552c9"
    },
    "onboardly": {
      "built_at": "2026-08-15T10:46:20+00:00",
      "contract_version": "1.0.0",
      "digest": "sha256:5fced35882dd6fed435926ec77ebf97b4cbf23d0e565ebfde33b7d1b21e6a0fc",
      "docs_hash": "sha256:b056b40c766b9a0ff39f9ade462c38ce5c9540afb7784a9523578c84f30879c4",
      "local_tag": "onboardly:local",
      "platform": "linux/amd64",
      "registry_ref": "us-central1-docker.pkg.dev/llmobserver-0/integration-bench-public/ib-vendor-onboardly",
      "sbom": null,
      "signature": null,
      "source_hash": "sha256:371c548c786a6c78989941aa38533f6c02d48f21f0f005b9d20ec18151794e34",
      "source_revision": "ab7432d77e320104166ba1f757dd349f6f5552c9"
    },
    "paygrade": {
      "built_at": "2026-08-15T10:46:20+00:00",
      "contract_version": "1.0.0",
      "digest": "sha256:b2acb31c6143eca839ad8c69fcd14248a0cf717fb574dea2e6c13b2efa465823",
      "docs_hash": "sha256:d8387249bc4ad446d25b0094aea009e20064c82d8210b604f97d4526cf9054bf",
      "local_tag": "paygrade:local",
      "platform": "linux/amd64",
      "registry_ref": "us-central1-docker.pkg.dev/llmobserver-0/integration-bench-public/ib-vendor-paygrade",
      "sbom": null,
      "signature": null,
      "source_hash": "sha256:bb0d26dea36117de24674c1fe286f958c4711bc12e2e6d0eb2c56514f6e5263c",
      "source_revision": "ab7432d77e320104166ba1f757dd349f6f5552c9"
    },
    "placemint": {
      "built_at": "2026-08-15T10:46:58+00:00",
      "contract_version": "1.0.0",
      "digest": "sha256:6e0b8c26be8833d4903cb297a67f607cedf9bb42cb029465d6f997305df48fc7",
      "docs_hash": "sha256:6bb9a67db8bf36fccec6a5611edbd5cd0ef7bbe23c17928a4b92febbc59e9f36",
      "local_tag": "placemint:local",
      "platform": "linux/amd64",
      "registry_ref": "us-central1-docker.pkg.dev/llmobserver-0/integration-bench-public/ib-vendor-placemint",
      "sbom": null,
      "signature": null,
      "source_hash": "sha256:1e17eac864579835161356d84150667e96d6e9983bce6e020ecf048e85daef89",
      "source_revision": "ab7432d77e320104166ba1f757dd349f6f5552c9"
    },
    "recruitos": {
      "built_at": "2026-08-15T10:46:57+00:00",
      "contract_version": "1.0.0",
      "digest": "sha256:00aac165a1bec0a5ab0fb844535a1956f73f2c988e95f94bebfaa5b0bea865c6",
      "docs_hash": "sha256:371474c71ba25e563230e45931f19b8639523672a7a4c86bace2c2347bc97ac3",
      "local_tag": "recruitos:local",
      "platform": "linux/amd64",
      "registry_ref": "us-central1-docker.pkg.dev/llmobserver-0/integration-bench-public/ib-vendor-recruitos",
      "sbom": null,
      "signature": null,
      "source_hash": "sha256:b71a22824896a449febc376b570be979cbb664c48da7dbd1a2f69c99bdf84b62",
      "source_revision": "ab7432d77e320104166ba1f757dd349f6f5552c9"
    },
    "rosterly": {
      "built_at": "2026-08-15T10:47:35+00:00",
      "contract_version": "1.0.0",
      "digest": "sha256:537125a06fb9f112282a2942426130ccde0729bb5edc594abc9e0418755cafb8",
      "docs_hash": "sha256:4e1da0eeb31feacdcdc53562d584416a5772f44953ab0b991d8421b098e2547e",
      "local_tag": "rosterly:local",
      "platform": "linux/amd64",
      "registry_ref": "us-central1-docker.pkg.dev/llmobserver-0/integration-bench-public/ib-vendor-rosterly",
      "sbom": null,
      "signature": null,
      "source_hash": "sha256:ddb639ccb4c588bfb441a525d22149d5bbaa353dc70a6dfd1da293876754f8dd",
      "source_revision": "ab7432d77e320104166ba1f757dd349f6f5552c9"
    },
    "sourcewell": {
      "built_at": "2026-08-15T10:47:37+00:00",
      "contract_version": "1.0.0",
      "digest": "sha256:5e943156e4918a36e969466fea693e98e917d1766060fd637c4c4a30e58e9017",
      "docs_hash": "sha256:8e9e539ac2a0356e8d3d445c76e6cc5147755fc3c57c32851d81b725547c74cb",
      "local_tag": "sourcewell:local",
      "platform": "linux/amd64",
      "registry_ref": "us-central1-docker.pkg.dev/llmobserver-0/integration-bench-public/ib-vendor-sourcewell",
      "sbom": null,
      "signature": null,
      "source_hash": "sha256:05d186c7005a6bba13bd50cdcbc80f4d4d70b02285911a6c953bf9ddd0ecef50",
      "source_revision": "ab7432d77e320104166ba1f757dd349f6f5552c9"
    },
    "staffline": {
      "built_at": "2026-08-15T14:54:01+00:00",
      "contract_version": "1.0.0",
      "digest": "sha256:731c6467078a262b771e99efc561a52379dcbea223cf4dd6ca7ca116e6409609",
      "docs_hash": "sha256:3b590ebda6cf65768d3da78ed7fb331fbe29c3e4a5ed1d7f568fe42afbbeaab2",
      "local_tag": "staffline:local",
      "platform": "linux/amd64",
      "registry_ref": "us-central1-docker.pkg.dev/llmobserver-0/integration-bench-public/ib-vendor-staffline",
      "sbom": null,
      "signature": null,
      "source_hash": "sha256:dc4bac2e556611408b18f0c2ace5a8afb5026f75c54ccb24d0c0d5913c6d91b0",
      "source_revision": "d655ab5e4d911d6a284a9e0359ce373c84f03b0f"
    },
    "talentforge": {
      "built_at": "2026-08-15T10:48:12+00:00",
      "contract_version": "1.0.0",
      "digest": "sha256:aa8e4d33a1aa3575b892da425a97b742454219bed8ba3d290b8c783d7f644953",
      "docs_hash": "sha256:47e187f9a292a17fb3d38181a89a2faa77ef8c0825ff0511b15a08323b8b4dc8",
      "local_tag": "talentforge:local",
      "platform": "linux/amd64",
      "registry_ref": "us-central1-docker.pkg.dev/llmobserver-0/integration-bench-public/ib-vendor-talentforge",
      "sbom": null,
      "signature": null,
      "source_hash": "sha256:de29afe21fc1cb485a5f7fa02d53aedd62438fab811ab3868544ff9067aca3e9",
      "source_revision": "ab7432d77e320104166ba1f757dd349f6f5552c9"
    },
    "talentloop": {
      "built_at": "2026-08-15T10:48:13+00:00",
      "contract_version": "1.0.0",
      "digest": "sha256:342b7173f139ad11cd3f7462bb918a6dee97bcdf1638817700681b23c1d5d97c",
      "docs_hash": "sha256:a56b6275d97fdba1760f38b07c9a9c37062cdc862feebbcdc4a396f4d6fbdb33",
      "local_tag": "talentloop:local",
      "platform": "linux/amd64",
      "registry_ref": "us-central1-docker.pkg.dev/llmobserver-0/integration-bench-public/ib-vendor-talentloop",
      "sbom": null,
      "signature": null,
      "source_hash": "sha256:18766759c0f4f5d2ec6a1969e63c4bf833f64b197c6c25ff9bfede4b6ea295d3",
      "source_revision": "ab7432d77e320104166ba1f757dd349f6f5552c9"
    },
    "vettly": {
      "built_at": "2026-08-15T10:48:13+00:00",
      "contract_version": "1.0.0",
      "digest": "sha256:2bfe5a2117ed19c632a6d87ed65e1457508201cbe290f04f84d9d9ca87bced7b",
      "docs_hash": "sha256:b8f4d9fbf3407a83f59ab686a83256cec7121650f25a4d5f473e2d963dbe0903",